{
  "$schema": "../../schemas/skill.schema.json",
  "id": "lammps-on-slurm",
  "name": "LAMMPS On Slurm",
  "version": "0.1.0",
  "status": "draft",
  "summary": "Run LAMMPS molecular dynamics jobs on Slurm with MPI, GPU, and restart planning.",
  "description": "This skill provides a conservative Slurm pattern for LAMMPS jobs, including MPI task layout, optional GPU/KOKKOS notes, restart and log controls, and a dry-run-first Lennard-Jones smoke test.",
  "categories": ["mpi", "scheduler", "performance"],
  "tags": ["lammps", "molecular-dynamics", "mpi", "slurm", "restart", "gpu"],
  "maintainers": [
    {
      "name": "HPC Skill Hub Maintainers"
    }
  ],
  "license": "MIT",
  "maturity": "seed",
  "risk_level": "medium",
  "schedulers": ["slurm"],
  "tools": [
    {
      "name": "lmp",
      "required": false,
      "notes": "Common LAMMPS executable name; sites may use lmp_mpi, lammps, or module wrappers."
    },
    {
      "name": "sbatch",
      "required": true
    },
    {
      "name": "srun",
      "required": true
    },
    {
      "name": "mkdir",
      "required": true
    },
    {
      "name": "date",
      "required": true
    },
    {
      "name": "hostname",
      "required": true
    },
    {
      "name": "tee",
      "required": true
    },
    {
      "name": "test",
      "required": true
    }
  ],
  "inputs": [
    {
      "name": "input_script",
      "type": "path",
      "required": true,
      "description": "LAMMPS input script such as in.lj."
    },
    {
      "name": "lammps_executable",
      "type": "string",
      "required": false,
      "description": "LAMMPS executable or wrapper command available in the job environment."
    },
    {
      "name": "nodes",
      "type": "integer",
      "required": false,
      "description": "Number of Slurm nodes to request."
    },
    {
      "name": "ntasks",
      "type": "integer",
      "required": false,
      "description": "Total MPI ranks or Slurm tasks for the run."
    },
    {
      "name": "output_dir",
      "type": "path",
      "required": true,
      "description": "Durable output directory for logs, restart files, and run records."
    }
  ],
  "outputs": [
    {
      "name": "lammps_launch_plan",
      "description": "Reviewable Slurm, MPI, executable, input, log, and restart plan."
    },
    {
      "name": "lammps_log",
      "description": "LAMMPS log file captured with a deterministic path."
    },
    {
      "name": "restart_files",
      "description": "Optional restart files generated by the LAMMPS input script."
    }
  ],
  "artifacts": [
    "README.md",
    "examples/lammps-smoke.sbatch",
    "examples/in.lj",
    "examples/restart-checklist.md"
  ],
  "examples": [
    {
      "title": "Plan or run a LAMMPS smoke test on Slurm",
      "path": "examples/lammps-smoke.sbatch"
    },
    {
      "title": "Tiny Lennard-Jones input",
      "path": "examples/in.lj"
    },
    {
      "title": "LAMMPS restart checklist",
      "path": "examples/restart-checklist.md"
    }
  ],
  "tests": [
    {
      "type": "static",
      "command": "python3 tools/validate_skills.py --skill lammps-on-slurm",
      "description": "Validate the manifest and referenced examples."
    },
    {
      "type": "manual",
      "description": "Run plan-only mode first, then set RUN_LAMMPS=1 on a short debug partition with a site-approved LAMMPS executable."
    }
  ],
  "references": [
    {
      "title": "LAMMPS running basics",
      "url": "https://docs.lammps.org/Run_basics.html"
    },
    {
      "title": "LAMMPS command-line options",
      "url": "https://docs.lammps.org/Run_options.html"
    },
    {
      "title": "LAMMPS restart command",
      "url": "https://docs.lammps.org/restart.html"
    },
    {
      "title": "LAMMPS GPU package",
      "url": "https://docs.lammps.org/Speed_gpu.html"
    }
  ]
}
